{
  "scenario_id" : "mixed-exceptions",
  "scenario_name" : "Mixed exceptions",
  "generator_version" : "1.1.0",
  "random_seed" : 42,
  "fixed_start_date" : "2026-01-01",
  "generation_timestamp" : "2026-01-01T00:00:00Z",
  "canonical_payment_count" : 1000,
  "file_row_counts" : {
    "bank_settlements.csv" : 219,
    "expected_reconciliation.csv" : 1244,
    "internal_transactions.csv" : 1010,
    "internal_transactions_duplicate.csv" : 1010,
    "processor_transactions.csv" : 1075
  },
  "injected_exception_counts" : {
    "ambiguous_matches" : 10,
    "amount_mismatches" : 20,
    "bank_amount_mismatches" : 10,
    "bank_currency_mismatches" : 10,
    "bank_only_entries" : 5,
    "currency_mismatches" : 10,
    "duplicate_bank_entries" : 10,
    "duplicate_internal_records" : 10,
    "duplicate_processor_records" : 20,
    "duplicated_source_files" : 1,
    "fee_mismatches" : 20,
    "full_refunds" : 20,
    "late_settlements" : 20,
    "malformed_rows" : 5,
    "missing_bank_settlements" : 10,
    "missing_processor_records" : 20,
    "partial_refunds" : 20,
    "processor_only_records" : 20
  },
  "assumed_exception_rates" : {
    "ambiguous_matches" : "1.00%",
    "amount_mismatches" : "2.00%",
    "bank_amount_mismatches" : "1.00%",
    "bank_currency_mismatches" : "1.00%",
    "bank_only_entries" : "0.50%",
    "currency_mismatches" : "1.00%",
    "duplicate_bank_entries" : "1.00%",
    "duplicate_internal_records" : "1.00%",
    "duplicate_processor_records" : "2.00%",
    "fee_mismatches" : "2.00%",
    "full_refunds" : "2.00%",
    "late_settlements" : "2.00%",
    "malformed_rows" : "0.50%",
    "missing_bank_settlements" : "1.00%",
    "missing_processor_records" : "2.00%",
    "partial_refunds" : "2.00%",
    "processor_only_records" : "2.00%"
  },
  "fee_policy" : {
    "percentage_rate" : "2.90%",
    "fixed_charge" : "0.30",
    "rounding_mode" : "HALF_UP",
    "net_amount_formula" : "gross_amount - fee_amount"
  },
  "settlement_window" : "3 calendar days after the latest processor event in a batch",
  "currencies" : [ "EUR", "GBP", "USD" ],
  "file_sha256_checksums" : {
    "README.md" : "583881c26e5f0b04461b354e7bb2496f05b449bbefac91c7a997c742a0c490aa",
    "bank_settlements.csv" : "ab04479ee55193e39f965067af9348fddb01aa79b7d1255ecd59105f708a66ee",
    "expected_reconciliation.csv" : "3fe217524798882c3ee2c329ecfb34d23d574b02835fd0dcf0dc481c94b28e3a",
    "internal_transactions.csv" : "41b10dada5952c24103dca2e7c73713d8b99f1616d7bb953a5455904d4169459",
    "internal_transactions_duplicate.csv" : "41b10dada5952c24103dca2e7c73713d8b99f1616d7bb953a5455904d4169459",
    "processor_transactions.csv" : "b047ae72f6f36014012243074e77e37f5ae35635192fd0fc44c08e498ac754cf"
  },
  "checksum_scope" : "Checksums cover every loose scenario file except this manifest and the ZIP archive, which would otherwise require recursive checksums.",
  "expected_reconciliation_summary" : {
    "AMBIGUOUS_MATCH" : 10,
    "AMOUNT_MISMATCH" : 47,
    "CURRENCY_MISMATCH" : 20,
    "DUPLICATE_BANK_ENTRY" : 10,
    "DUPLICATE_INTERNAL" : 10,
    "DUPLICATE_PROCESSOR" : 20,
    "FEE_MISMATCH" : 20,
    "INVALID_SOURCE_ROW" : 5,
    "LATE_SETTLEMENT" : 20,
    "MATCHED" : 987,
    "MISSING_BANK_SETTLEMENT" : 10,
    "MISSING_INTERNAL" : 20,
    "MISSING_PROCESSOR" : 25,
    "PARTIAL_REFUND" : 20,
    "REFUND_MATCHED" : 20
  },
  "expected_reconciliation_summary_by_scope" : {
    "ORDER" : {
      "AMBIGUOUS_MATCH" : 10,
      "AMOUNT_MISMATCH" : 20,
      "CURRENCY_MISMATCH" : 10,
      "DUPLICATE_INTERNAL" : 10,
      "DUPLICATE_PROCESSOR" : 20,
      "FEE_MISMATCH" : 20,
      "INVALID_SOURCE_ROW" : 5,
      "MATCHED" : 850,
      "MISSING_INTERNAL" : 20,
      "MISSING_PROCESSOR" : 20,
      "PARTIAL_REFUND" : 20,
      "REFUND_MATCHED" : 20
    },
    "SETTLEMENT" : {
      "AMOUNT_MISMATCH" : 27,
      "CURRENCY_MISMATCH" : 10,
      "DUPLICATE_BANK_ENTRY" : 10,
      "LATE_SETTLEMENT" : 20,
      "MATCHED" : 137,
      "MISSING_BANK_SETTLEMENT" : 10,
      "MISSING_PROCESSOR" : 5
    }
  },
  "synthetic_data_disclaimer" : "This dataset is entirely synthetic. It contains no genuine people, payments, cards, bank accounts, addresses, or customer identifiers.",
  "exception_percentages_assumption" : "All exception percentages and distributions are documented demonstration assumptions; they are not measurements of real payment behavior."
}
